{
  "$schema": "https://json-schema.org/draft/2020-12/schema",
  "$id": "reit_facts.schema.json",
  "title": "PH REIT facts extracted from one filing",
  "description": "Contract between extraction and analysis. Values are whole pesos (except per-share and percentages), signed as presented in the statements. Every fact cites the printed page it came from. Q2 and Q3 17-Q filings report cash flows year-to-date only, so they are analyzed on a year-to-date basis (period_type half or nine_months) using the year-to-date columns throughout.",
  "type": "object",
  "required": ["meta", "facts"],
  "properties": {
    "meta": {
      "type": "object",
      "required": ["ticker", "company", "form_type", "period_end", "period_type", "accounting_model", "accounting_model_page", "source_file"],
      "properties": {
        "ticker": {"type": "string", "examples": ["AREIT"]},
        "company": {"type": "string"},
        "form_type": {"type": "string", "enum": ["17-Q", "17-A"]},
        "period_end": {"type": "string", "format": "date"},
        "period_type": {"type": "string", "enum": ["quarter", "half", "nine_months", "year"]},
        "period_label": {"type": "string", "examples": ["2026-Q1", "2026-H1", "2026-9M", "2026-FY"]},
        "filing_date": {"type": "string", "format": "date"},
        "source_file": {"type": "string"},
        "accounting_model": {"type": "string", "enum": ["fair_value", "cost"]},
        "accounting_model_page": {"type": "integer"},
        "page_basis": {"type": "string", "description": "How page numbers are counted: starts with 'printed' (the number printed on the page, when it equals the PDF position throughout, as in most 17-Qs) or 'pdf_index' (the page's position in the PDF; required for 17-As, whose printed numbering restarts). index_pages.py suggests which."},
        "document_map": {
          "type": "array",
          "description": "Page ranges of the documents bundled in the PDF.",
          "items": {
            "type": "object",
            "properties": {
              "document": {"type": "string"},
              "pages": {"type": "string"},
              "has_text_layer": {"type": "boolean"}
            }
          }
        },
        "extracted_by": {"type": "string"},
        "notes": {"type": "string"}
      }
    },
    "facts": {
      "type": "object",
      "required": [
        "net_income", "total_revenue", "capex_investment_property",
        "shares_outstanding",
        "total_assets", "total_liabilities", "total_equity"
      ],
      "additionalProperties": {"$ref": "#/$defs/fact"},
      "properties": {
        "net_income": {"$ref": "#/$defs/fact"},
        "total_revenue": {"$ref": "#/$defs/fact"},
        "rental_income": {"$ref": "#/$defs/fact"},
        "finance_lease_interest_income": {"$ref": "#/$defs/fact"},
        "fair_value_change": {"$ref": "#/$defs/fact", "description": "Signed. Loss is negative. Required for fair_value model."},
        "real_estate_depreciation": {"$ref": "#/$defs/fact", "description": "Required for cost model."},
        "gain_on_property_sale": {"$ref": "#/$defs/fact", "description": "Gain (positive) or loss (negative) on disposal of investment property. Removed from FFO under both accounting models."},
        "fair_value_appraisal_gain": {"$ref": "#/$defs/fact", "description": "Annual reports: the appraisal part of the net fair value change (e.g. 'Fair value adjustment' in the investment properties note). Signed."},
        "fair_value_straight_line_offset": {"$ref": "#/$defs/fact", "description": "Annual reports: the straight-line adjustment netted inside the fair value change. Signed as printed (usually negative)."},
        "fair_value_lease_commissions": {"$ref": "#/$defs/fact", "description": "Annual reports: lease commissions netted inside the fair value change. Signed as printed (usually negative)."},
        "depreciation_amortization": {"$ref": "#/$defs/fact", "description": "Total D&A from the cash flow (may include non-real-estate items)."},
        "straight_line_rent_adjustment": {"$ref": "#/$defs/fact", "description": "Positive amount deducted for non-cash straight-line rent."},
        "capex_investment_property": {"$ref": "#/$defs/fact", "description": "Positive amount paid for additions to investment properties."},
        "operating_cash_flow": {"$ref": "#/$defs/fact"},
        "dividends_paid": {"$ref": "#/$defs/fact"},
        "change_due_from_related_parties": {"$ref": "#/$defs/fact", "description": "Investing cash flow line; negative = cash lent to related parties."},
        "total_assets": {"$ref": "#/$defs/fact"},
        "total_liabilities": {"$ref": "#/$defs/fact"},
        "total_equity": {"$ref": "#/$defs/fact"},
        "total_debt": {"$ref": "#/$defs/fact"},
        "cash": {"$ref": "#/$defs/fact"},
        "accrued_rent_receivable": {"$ref": "#/$defs/fact"},
        "accrued_rent_receivable_prior": {"$ref": "#/$defs/fact"},
        "finance_lease_receivable": {"$ref": "#/$defs/fact"},
        "finance_lease_receivable_prior": {"$ref": "#/$defs/fact"},
        "finance_lease_receivable_fair_value": {"$ref": "#/$defs/fact", "description": "Disclosed fair value of finance lease receivables (fair value measurement note, annual reports). Used for the fair-value-adjusted NAV; never estimate it."},
        "investment_property_carrying": {"$ref": "#/$defs/fact", "description": "Cost model: carrying amount of investment property."},
        "investment_property_fair_value": {"$ref": "#/$defs/fact", "description": "Cost model: disclosed fair value of investment property (PAS 40 disclosure)."},
        "interest_expense": {"$ref": "#/$defs/fact", "description": "Interest expense and other charges (income statement)."},
        "interest_income": {"$ref": "#/$defs/fact", "description": "Interest income other than finance lease interest (income statement)."},
        "other_income": {"$ref": "#/$defs/fact", "description": "Other income (income statement)."},
        "income_tax_expense": {"$ref": "#/$defs/fact"},
        "reported_interest_coverage": {"$ref": "#/$defs/fact", "description": "Interest coverage ratio as reported (financial soundness indicators). Cross-check."},
        "shares_outstanding": {"$ref": "#/$defs/fact"},
        "shares_outstanding_prior": {"$ref": "#/$defs/fact", "description": "Shares outstanding at the start of the period (prior year-end column). Used to flag shares issued during the period."},
        "reported_distributable_income": {"$ref": "#/$defs/fact"},
        "dividend_per_share_declared": {"$ref": "#/$defs/fact", "description": "Dividend declared FOR this period (may be declared after period end). Use the dividends list instead when the period has more than one declaration."},
        "dividend_declared_total_reported": {"$ref": "#/$defs/fact", "description": "Reported peso total of the dividends declared for the period (one declaration, or the period's total when there is a dividends list)."},
        "reported_payout_pct": {"$ref": "#/$defs/fact", "description": "The company's own payout of distributable income, in percent (annual reports). Cross-check."},
        "retained_earnings_available_for_dividends": {"$ref": "#/$defs/fact", "description": "Annual reports: total retained earnings available for dividend declaration at year-end (supplementary schedule)."},
        "net_income_quarter": {"$ref": "#/$defs/fact", "description": "Year-to-date filings only: net income for the latest quarter as printed in the filing's quarter column. Cross-checks the derived quarter."},
        "fair_value_change_quarter": {"$ref": "#/$defs/fact", "description": "Year-to-date filings only: fair value change for the latest quarter as printed. Cross-checks the derived quarter."},
        "mdna_net_income_before_fv_change": {"$ref": "#/$defs/fact", "description": "Cross-check only."},
        "reported_nav_per_share": {"$ref": "#/$defs/fact", "description": "NAV per share as reported by the company. Cross-check, and the basis for price / NAV."},
        "reported_nav_per_share_prior": {"$ref": "#/$defs/fact", "description": "Reported NAV per share at the prior year-end. Compared with issue prices of shares issued during the period."},
        "market_price_close": {"$ref": "#/$defs/fact", "description": "Closing share price for the latest quarter from the filing's market information table."},
        "available_credit_line": {"$ref": "#/$defs/fact", "description": "Unused credit lines available at period end, as disclosed."},
        "sponsor_ownership_pct": {"$ref": "#/$defs/fact"}
      }
    },
    "trailing_dividends": {
      "type": "array",
      "description": "Dividend per share declared for each of the last four quarters up to and including the latest quarter, for the trailing yield.",
      "items": {
        "type": "object",
        "required": ["for_period", "dividend_per_share"],
        "properties": {
          "for_period": {"type": "string", "examples": ["2025-Q3"]},
          "dividend_per_share": {"$ref": "#/$defs/fact"}
        }
      }
    },
    "share_issuances": {
      "type": "array",
      "description": "Rows of the share issuance (property-for-share swap) table, including comparative-year rows.",
      "items": {
        "type": "object",
        "required": ["property", "year", "transaction_value", "shares", "issue_price", "paid_up_capital", "apic"],
        "properties": {
          "property": {"type": "string"},
          "year": {"type": "integer"},
          "transaction_value": {"$ref": "#/$defs/fact"},
          "shares": {"$ref": "#/$defs/fact"},
          "issue_price": {"$ref": "#/$defs/fact"},
          "paid_up_capital": {"$ref": "#/$defs/fact"},
          "apic": {"$ref": "#/$defs/fact"},
          "nav_before": {"$ref": "#/$defs/fact", "description": "Latest reported NAV per share before the issuance that this filing discloses."}
        }
      }
    },
    "share_issuance_totals": {
      "type": "array",
      "description": "The printed totals row of the share issuance table, one entry per year. Used to tell a typo in one row from an error in the whole table.",
      "items": {
        "type": "object",
        "required": ["year", "transaction_value", "paid_up_capital", "apic"],
        "properties": {
          "year": {"type": "integer"},
          "transaction_value": {"$ref": "#/$defs/fact"},
          "shares": {"$ref": "#/$defs/fact"},
          "paid_up_capital": {"$ref": "#/$defs/fact"},
          "apic": {"$ref": "#/$defs/fact"}
        }
      }
    },
    "subsequent_events": {
      "type": "array",
      "description": "Events after the reporting date that affect shares, debt or dividends.",
      "items": {
        "type": "object",
        "required": ["date", "type", "description"],
        "properties": {
          "date": {"type": "string", "format": "date"},
          "type": {"type": "string", "enum": ["share_issuance", "cash_acquisition", "debt", "dividend", "other"]},
          "description": {"type": "string"},
          "shares": {"$ref": "#/$defs/fact"},
          "transaction_value": {"$ref": "#/$defs/fact"},
          "amount": {"$ref": "#/$defs/fact"}
        }
      }
    },
    "dividends": {
      "type": "array",
      "description": "Every dividend declared FOR this period, one entry per declaration, each with the share count on its record date. Use when the period covers more than one quarter (e.g. Q1 and Q2 dividends in a half-year review). Either this or facts.dividend_per_share_declared is required; this takes precedence.",
      "minItems": 1,
      "items": {
        "type": "object",
        "required": ["for_period", "dividend_per_share", "shares"],
        "properties": {
          "for_period": {"type": "string", "examples": ["2026-Q1"]},
          "dividend_per_share": {"$ref": "#/$defs/fact"},
          "shares": {"$ref": "#/$defs/fact", "description": "Shares outstanding on the record date."},
          "reported_total": {"$ref": "#/$defs/fact", "description": "Peso total as reported by the company."}
        }
      }
    }
  },
  "$defs": {
    "fact": {
      "type": "object",
      "required": ["value", "page"],
      "properties": {
        "value": {"type": "number"},
        "page": {"type": "integer", "description": "Printed page number (see meta.page_basis)."},
        "pdf_page": {"type": "integer", "description": "PDF page index if it differs from the printed page."},
        "label": {"type": "string", "description": "Exact text printed on the cited page (line item name or a short phrase next to the value), so a reader can search the PDF for it. Context goes in column or note, not here. scripts/check_citations.py verifies it."},
        "column": {"type": "string", "description": "Column header the value sits under, e.g. 'January 1 to June 30, 2026' or 'December 31, 2025'."},
        "confidence": {"type": "string", "enum": ["high", "medium", "low"], "default": "high"},
        "citation": {"type": "string", "enum": ["text", "visual"], "default": "text", "description": "'visual' when the page has no text layer and the value was read from the page image. check_citations.py can't verify it, so confidence must be medium or low."},
        "rounded": {"type": "boolean", "description": "True if the filing reported this rounded (in millions unless unit says otherwise) and it was converted to pesos."},
        "unit": {"type": "string", "enum": ["million", "billion"], "default": "million", "description": "Unit the rounded figure was printed in."},
        "note": {"type": "string"},
        "also_reported": {
          "type": "array",
          "description": "Other places the filing prints the same figure. Each is citation-checked, and compute_metrics.py reports any that disagree as a likely inconsistency in the filing.",
          "items": {
            "type": "object",
            "required": ["value", "page", "label"],
            "properties": {
              "value": {"type": "number"},
              "page": {"type": "integer"},
              "label": {"type": "string"},
              "column": {"type": "string"},
              "rounded": {"type": "boolean"},
              "unit": {"type": "string", "enum": ["million", "billion"]}
            }
          }
        }
      }
    }
  }
}
